funder,works count
National Natural Science Foundation of China,115
Wellcome Trust,40
Medical Research Council,20
National Science Foundation,19
Engineering and Physical Sciences Research Council,15
National Key Research and Development Program of China,13
Biotechnology and Biological Sciences Research Council,12
Fundamental Research Funds for the Central Universities,12
FDA HHS,10
China Postdoctoral Science Foundation,9
China Scholarship Council,8
Natural Sciences and Engineering Research Council of Canada,8
NCI NIH HHS,7
NIMH NIH HHS,7
NHGRI NIH HHS,7
National Institutes of Health,6
Department of Health,6
PHS HHS,5
NINDS NIH HHS,5
Seventh Framework Programme,5
National Basic Research Program of China,5
NIH HHS,5
CCR NIH HHS,4
Natural Science Foundation of Shandong Province,4
EPSRC,4
Australian Research Council,4
U.S. Department of Energy,4
Natural Science Foundation of Shaanxi Province,4
Natural Science Foundation of China,4
Ministry of Science and Technology of the People's Republic of China,3
H2020 European Research Council,3
National Natural Science Foundation of China (CN),3
NIBIB NIH HHS,3
"Indian Institute of Technology, Bombay",3
Natural Science Foundation of Zhejiang Province,3
Simons Foundation,3
Austrian Research Promotion Agency,3
NLM NIH HHS,3
National Key Research and Development Plan,3
"Ministerio de Ciencia, Innovación y Universidades",3
Foundation of Science and Technology on Information Assurance Laboratory,3
National Research Foundation Singapore,3
Key Research Project of Zhejiang Province,3
Natural Science Foundation of Fujian Province,3
AHRQ HHS,3
National Institute of Standards and Technology,3
Division of Information and Intelligent Systems,3
Social Sciences and Humanities Research Council of Canada,3
Fundação de Amparo à Pesquisa do Estado de São Paulo,3
Ministry of Education,3
Ministry of Science and Technology,3
National Nature Science Foundation of China,3
Defense Advanced Research Projects Agency,3
Huawei Technologies,3
National Cryptography Development Fund,3
Natural Science Foundation of Guangdong Province,3
Priority Academic Program Development of Jiangsu Higher Education Institutions,3
Air Force Research Laboratory,3
Natural Science Foundation of Beijing Municipality,3
European Regional Development Fund,3
Austrian Science Fund FWF,3
US National Science Foundation,3
"Departamento Administrativo de Ciencia, Tecnología e Innovación (COLCIENCIAS)",3
International Development Research Centre,3
Horizon 2020 Framework Programme,3
Natural Science Foundation of Hunan Province,2
European Commission (EC),2
Patient-Centered Outcomes Research Institute,2
NIDA NIH HHS,2
NIAID NIH HHS,2
NIAMS NIH HHS,2
NHLBI NIH HHS,2
Intramural NIST DOC,2
NCATS NIH HHS,2
Natural Science Basic Research Plan in Shaanxi Province,2
Seventh Framework Programme (BE),2
Leverhulme Trust,2
NIGMS NIH HHS,2
Science and Technology Commission of Shanghai Municipality,2
Guangxi Cognitive Radio and Information Processing Key Laboratory Authorized by China’s Ministry of Education Foundation,2
Guangxi Broadband Wireless Communication and Signal Processing Key Laboratory Foundation,2
Shandong Provincial Scientific Research Programs in Colleges and Universities,2
Guangxi Provincial Education Department Foundation,2
National Infrastructure Project,2
Open Research Fund from the Shandong Provincial Key Laboratory of Computer Network,2
2017 Open Foundation,2
ODCDC CDC HHS,2
German Federal Ministry of Education and Research,2
Horizon 2020,2
"Ministry of Business, Innovation and Employment",2
Program for Guangdong Introducing Innovative and Entrepreneurial Teams,2
Rey Juan Carlos University,2
"Department for International Development, UK Government",2
Guangxi Key Laboratory of Cryptography and Information Security,2
U.S. Department of Health &amp; Human Services ,2
NIH ,2
Chongqing Research Program of Basic Research and Frontier Technology,2
National Science Foundation of China,2
Division of Graduate Education,2
Canadian Cancer Genome Collaboratory,2
University of Michigan,2
Coordenação de Aperfeiçoamento de Pessoal de Nível Superior,2
NCCIH NIH HHS,2
"Ministry of Science and Technology, Taiwan",2
AXA Research Fund,2
University of Helsinki,2
Bill and Melinda Gates Foundation,2
State Grid Corporation of China,2
the Fundamental Research Funds for the Central Universities,2
Key Research Project of Shaanxi Province,2
Program for New Century Excellent Talents in University,2
International Science and Technology Cooperation and Exchange of Sichuan Province,2
Economic and Social Research Council,2
Vetenskapsrådet,2
Natural Science Foundation of Guangxi Province,2
auDA Foundation,2
European Social Fund,2
Spanish Government,2
"The Ministry of Science and Technology, Taiwan",2
"Special Fund for Key Program of Science and Technology of Anhui Province, China",2
Innovative Medicines Initiative,2
Beijing Natural Science Foundation,2
National Research Foundation of Korea,2
Wyng Foundation of Hong Kong,2
NEI NIH HHS,2
"Research Grants Council of the Hong Kong Special Administrative Region, China",2
Science and Technology Program of Guangdong Province,2
National Key R&D Program of China,2
Natural Science Foundation of Hubei Province of China,2
Natural Science Foundation of Inner Mongolia,2
National Cryptography Development Fund of China,2
Robert Wood Johnson Foundation,2
Canada Foundation for Innovation,2
IBM CAS Faculty Fellowship,2
The University of Nottingham,2
NCRR NIH HHS,2
CNPq,2
Strategic Priority Research Program of the Chinese Academy of Sciences,2
Ministerio de Ciencia e Innovación,2
National Aeronautics and Space Administration,2
Natural Science Foundation of Jiangsu Province,2
Opening Project of Shanghai Trusted Industrial Control Platform,2
Deutsche Forschungsgemeinschaft,2
Spanish Ministry of Economy and Competitiveness,2
Spanish Ministry of Science and Innovation,2
Projekt DEAL,2
National Institutes of Health (US),2
Japan Society for the Promotion of Science,2
Hong Kong RGC,1
Early-Stage Research Start-up,1
Central South University,1
Ministerstwo Nauki i Szkolnictwa Wyższego (Ministry of Science and Higher Education),1
KeyArea Research and Development Program of Guangdong Province,1
Hubei Technology Innovation Platform,1
Ministry of Education of the People's Republic of China,1
National Key Technologies R&D Program of China,1
Ministry of Education Innovation Research Team,1
"Ministarstvo Prosvete, Nauke i Tehnološkog Razvoja",1
University of Washington Royalty Research Fund,1
EU-Japan,1
JSPS Grant-in-Aid for Young Scientists (B),1
Marie Sk?odowska-Curie,1
Australia ARC,1
Postdoctoral Research Foundation of China,1
Natural Science Foundation of Sichuan Province,1
Department of Science and Technology of Sichuan Province,1
Alma Mater Studiorum - Università di Bologna,1
Fundação de Amparo à Pesquisa do Estado de S. Paulo,1
NIEHS NIH HHS,1
Innovate UK,1
Chief Scientist Office,1
NINR NIH HHS,1
Chief Scientist Office [UK],1
Australian National Health and Medical Research Council Practitioner Fellowship,1
RRD VA,1
Cancer Council SA’s Beat Cancer Project on behalf of its donors and the State Government of South Australia through the Department of Health,1
"Ashley Hopkins is a researcher funded by a Postdoctoral Fellowship from the National Breast Cancer Foundation, Australia",1
Eunice Kennedy Shriver National Institute of Child Health and Human Development,1
"Teva Branded Pharmaceutical Products R&D, Inc. (Frazer, PA)",1
Scientific Research Program Funded by Shaanxi Provincial Education Department,1
New Star Team of Xi’an University of Posts and Telecommunications,1
Iowa Department of Transportation,1
Humanities and Social Sciences,1
Jiangsu province key research and development program: Social development project,1
Project of ZTE Cooperation Research,1
Jiangsu province key research and development program: Industry outlook and common key technology projects,1
University of Lancaster,1
"1311 Talent Plan Foundation of NUPT, NUPTSF",1
Qing Lan Project of Jiangsu Province,1
Open Foundation of the State Key Laboratory of Information Security of China,1
Suomen Akatemia,1
Electronics and Telecommunications Research Institute (ETRI) Grant through Korean Government,1
Institute of Information and Communications Technology Planning and Evaluation (IITP) Grant through Korean Government [Ministry of Science and ICT (MSIT)],1
SSHRC,1
Seattle Children’s Enterprise Analytics,1
Andrew Carnegie Fellowship,1
"The Europe Center of Stanford University, United States",1
Austrian Research Promotion Agency (FFG),1
"Austrian Federal Ministry of Transport, Innovation and Technology (BMVIT)",1
Agencia Nacional de Investigación e Innovación,1
HIT University Educational Research Project,1
AHRC,1
Key Natural Science Foundation of Education Bureau of Anhui Province,1
The Insight Centre for Data Analytics,1
European Commission Erasmus+ programme,1
The IITP (Institute of Information and Communications Technology Planning and Evaluation),1
Amazon AWS in Education Research Grant,1
"Key Laboratory of Broadband Wireless Communication and Sensor Network Technology, Nanjing University of Posts and Telecommunications",1
DH ,1
National Institute for Health Research (NIHR),1
KTH SmarTS Lab,1
Arts and Humanities Research Council,1
Guangdong University of Petrochemical Technology’s Internal Project,1
Aspen Center for Physics,1
Xuzhou Medical Young Talents Projects,1
Jiangsu Provincial Medical Youth Talent,1
"Canada Excellence Research Chairs, Government of Canada",1
KU Leuven,1
ESRC,1
Shandong Provincial Natural Science Foundation for Young Scholars of China,1
Division of Advanced Cyberinfrastructure,1
Fundação para a Ciência e a Tecnologia,1
National Institute for Health Research (NIHR; https://www.nihr.ac.uk/) Doctoral Research Fellowship,1
China Social Science Fund,1
Universität Zürich,1
Schweizerischer Nationalfonds zur Förderung der Wissenschaftlichen Forschung,1
Politecnico di Milano,1
French Ministry for Europe and Foreign Affairs,1
"Fundamental Research Funds for the Central Universities, CHD",1
H2020 LEIT Information and Communication Technologies,1
iMinds,1
"Centre for Teaching and Learning, Universiti Teknologi Malaysia",1
University of Rijeka,1
Interreg NWE,1
National Key Research Program of China,1
Innovation special zone,1
Royal Brisbane and Women’s Hospital Foundation,1
Queensland University of Technology,1
This article is published under the Creative Commons Attribution Non-commercial License.,1
EU TagItSmart! Project,1
EU-India REACH,1
Fondo Nacional de Desarrollo Científico y Tecnológico,1
Northeastern University,1
Key Project in the National Science and Technology Pillar Program of China,1
Industrial Internet Innovation and Development Project,1
Guangzhou Key Industrial Technology Project,1
Key R&amp;D Program in Key Areas of Guangdong Province,1
"Ministry of Economic Affairs, Dutch Government",1
Food and Agriculture Organization of the United Nations,1
U.S. Department of Agriculture,1
H2020 Marie Sk?odowska-Curie Actions,1
Scientific Research Fund of Hunan Provincial Education Department,1
Guangdong Province Natural Science Foundation of major basic research and Cultivation project,1
Project of Ordinary University Innovation Team Construction of Guangdong Province,1
Collaborative Innovation Major Projects of Bureau of Education of Guangzhou City,1
Basic Research Major Projects of Department of education of Guangdong Province,1
Foundation of National Natural Science of China,1
Natural Science Foundation of Guangxi Zhuang Autonomous Region,1
Health Services Research Competitive Research Grant,1
International Association of Mathematical Geosciences,1
Beijing Municipal Science and Technology Project,1
Laura and John Arnold Foundation,1
Exxon Valdez Oil Spill Trustee Council,1
Ministry of Education of China,1
Fujian Normal University Innovative Research Team,1
Fok Ying Tung Education Foundation,1
"Department of Education, Fujian Province",1
Directorate for Computer and Information Science and Engineering,1
the Department of Education of Zhejiang Province of China,1
the Opening Project of Guangdong Provincial Key Laboratory of Information Security Technology,1
the Key Research Project of Zhejiang Province,1
National Institute of General Medical Sciences (NIGMS),1
National Human Genome Research Institute (NHGRI),1
Ministry of Science and Technology of the People’s Republic of China,1
Japan Society for the Promotion of Science KAKENHI Grant,1
key Research and Development plan of Shaanxi province,1
key science and technology projects of State Grid Corporation of China,1
Key project of Anhui provincial department of education,1
AXA Research Fund and the Singapore National Research Foundation Cybersecurity RD,1
CONACYT – UC MEXUS,1
"University of California, Los Angeles",1
Major scientific and technological projects in Yunnan Province,1
Yunnan Applied Basic Research Projects,1
Yunnan Young Top Talents of Ten Thousands Plan,1
Key Project of Technology Innovation and Application Development of Chongqing,1
Deanship of Scientific Research at Prince Sattam Bin Abdulaziz University,1
National Key Research and Development Project,1
Overseas Returnees Innovation and Entrepreneurship Support Program of Chongqing,1
"Ministry of Education, Culture, Sports, Science, and Technology",1
Japan Agency for Medical Research and Development,1
Smart Technologies,1
AITF,1
SurfNet,1
Bulgarian National Science Fund,1
University of Birmingham,1
"Sandwell and West Birmingham, “Sandwell Medication Education Centre Trustee” grant for junior doctors",1
Federal Ministry of Education andResearch of Germany (BMBF),1
Netherlands Code of Conduct for Research Integrity,1
Division of Undergraduate Education,1
Health Research Authority,1
Young Scientists Fund of the National Natural Science Foundation of China,1
Ministry of Higher Education,1
Michigan Technological University,1
National Endowment for the Humanities,1
Innovation and Entrepreneurship Demonstration Team of Yingcai Program of Chongqing,1
Regional Council of Burgundy and Dijon University Hospital,1
AOI,1
Université de Bordeaux,1
European Commission,1
National Institute on Drug Abuse,1
Agence Universitaire de la Francophonie,1
Inter-university Consortium for Political and Social Research,1
Tistou and Charlotte Kerstan Foundation,1
Hong Kong RGC Project,1
Basic Research Program of Shenzhen,1
Russian Science Foundation,1
National Grand Fundamental Research 973 Program of China,1
NSFC Guang Dong,1
University of Macau,1
EC ,1
EU Framework Programme for Research and Innovation H2020 ,1
H2020 Priority Excellent Science ,1
H2020 Marie Skłodowska-Curie Actions (H2020 Excellent Science - Marie Skłodowska-Curie Actions),1
Grant,1
Xinjiang,1
Beijing Philosophy and Social Science Foundation,1
Dutch Research Council,1
"Ministry of Education, Science and Technological Development of the Republic of Serbia",1
Harvard University,1
Harvard’s Institute for Quantitative Social Science,1
"Spatiotemporal Thinking, Computing, and Applications Center (STC)",1
"U.S. National Endowment for the Humanities, Digital Humanities Implementation",1
U.S. National Science Foundation Industry-University Cooperative Research Centers Program (IUCRC),1
Youth Innovation Promotion Association,1
Wonkwang University,1
the Ministry of Science and ICT,1
Science Without Borders program,1
NIDDK NIH HHS,1
NIA NIH HHS,1
Natural Science Function of Qinghai Province,1
Netherlands Organisation for Health Research and Development,1
General University Hospital,1
COMMIT,1
European Defense Agency,1
Eurocontrol,1
ITEA2,1
Hong Kong GRF,1
"Intel Labs, US NSF",1
EPSCoR Cooperative agreement,1
KatuMetro research program,1
UK Engineering and Physical Sciences Research Council,1
European Commission under H2020-EU.3.1.5.1.,1
Central Election Commission of Taiwan (ROC),1
Science and Technology Planning Project of Sichuan Province,1
Canadian Institute of Health Research,1
NationalNatural Science Foundation of China,1
Tianjin Natural Science Foundation,1
National Human Genome Research Institute,1
"Center for Hierarchical Manufacturing, National Science Foundation",1
Exxon Mobil Corporation,1
"Eunice Kennedy Shriver National Institute of Child Health and Human Development (NICHD)’s Global Network for Women and Children’s Health Research, USA",1
National Research Center on Child and Maternal Health Dr. Hugo Mendoza (CENISMI).,1
ESRC Consumer Data Research Centre,1
111 Project,1
Southwest University for Nationalities,1
Key Fund Project of Sichuan Provincial Department of Education,1
Laboratory for Internet of Things and Mobile Internet Technology of Jiangsu Province,1
National Science Foundation (NSF),1
Health Research Services Administration,1
Programs of International Science and Technology Cooperation and Exchange of Sichuan Province,1
the China Postdoctoral Science Foundation Funded Project,1
the National Natural Science Foundation of Shaanxi Province,1
the AXA Research Fund,1
the Singapore National Research Foundation under the NCR Award,1
Key Research and Development Program of Jiangxi Province,1
Hong Kong Scholar Program,1
Office of Naval Research Global,1
National Security Agency,1
the National Social Science Fund of China,1
"the Graduates' Inovation Found, Huazhong University of Science and Technology",1
"the Fundamental Research Funds for the Central Universities, HUST",1
Purdue Research Foundation,1
The State Key Program of National Natural Science Foundation of China,1
The National Natural Science Foundation of China,1
Seoul National University,1
Österreichische Forschungsförderungsgesellschaft,1
European Union,1
"National Library of Medicine, National Institutes of Health",1
Johannes Kepler University Linz,1
Conselho Nacional de Desenvolvimento Científico e Tecnológico,1
Fujian Province Outstanding Young Scientific Researcher Training Project,1
Scientific Research Startup Foundation of Fujian University of Technology,1
Plan For Scientific Innovation Talent of Henan Province,1
Program for Science and Technology Innovation Talents in the Universities of Henan Province,1
International S&T Cooperation Program of Shaanxi Province,1
MEOPAR NCE,1
National Key Technologies R and D Programs of China,1
FP7 Ideas: European Research Council,1
Science and Technology Projects of Shenzhen,1
National High-Technology Research and Development Program (“863” Program) of China,1
Academy of Finland,1
Newcastle University,1
National Foundation for Science and Technology Development of Vietnam,1
University of San Diego,1
National Natural Science Foundation of Shaanxi Province,1
Peoples Republic of China Ministry of Education Distinguished Possessor,1
Science Foundation Ireland (SFI),1
Hunan Provincial Natural Science Fund for Distinguished Young Scholars,1
Preliminary Research Funding of NUDT,1
Ministry of Science ICT and Future Planning,1
Ministry of Health and Welfare,1
Special Fund for Key Program of Science and Technology of Anhui Province China,1
Open Fund of Key Laboratory of Embedded System and Service Computing Tongji University Ministry of Education,1
State Key Laboratory of High Performance Computing Project Fund,1
National University of Defense Technology,1
Shandong Province Higher Education Science and Technology Program,1
Research Fund KU Leuven,1
imec-ICON BoSS project,1
Tauno Tönning Foundation,1
Finnish Foundation for Technology Promotion,1
National Key Project in Cyber Security,1
Key Research and Development Projects of High and New Technology Development and Industrialization of Sichuan Province,1
Sichuan Province,1
Belgian Federal Science Policy Office,1
Charité - Universitätsmedizin Berlin,1
La Caixa,1
Shenzhen Fundamental Research Program,1
Guangdong Provincial Key Research and Development Plan Project,1
Guangdong Provincial Science and Technology Plan Project,1
"Department of Science and Technology, Hubei Provincial People's Government",1
Chongqing Science and Technology Foundation,1
Tarim University,1
Science and Technology Department of Xinjiang Uyghur Autonomous Region,1
Chongqing Municipal Education Commission,1
Royal Society,1
The Calleva Foundation,1
Royal Commission for the Exhibition of 1851,1
Human Origins Research Fund,1
Center for Cyber-physical System Innovation from The Featured Areas Research Center Program within the framework of the Higher Education Sprout Project by the Ministry of Education (MOE) in Taiwan,1
University of Bristol,1
Research Councils UK,1
Scan,1
Interface,1
University of Alberta,1
Universiteit Leiden,1
Science Fund for Distinguished Young Scholars in Hunan Province,1
IBM faculty award,1
Canadian Institutes of Health Research,1
Canarie,1
"South African DST-NRF Centre of Excellence in Scientometrics and Science, Technology and Innovation Policy",1
Vinnova,1
The Swedish Foundation for Strategic Research,1
The Swedish Research Council,1
Universität zu Lübeck,1
Natural Science Basic Research Plan in Shaanxi Province of China,1
Office of High Energy Physics,1
Office of Nuclear Physics,1
Heising-Simons Foundation,1
Key Technology Research & Innovation Team Project,1
U.S. Army,1
Grantová Agentura ðeské Republiky,1
Natural Environment Research Council,1
Philip Morris International,1
Universidad Rey Juan Carlos,1
The John Templeton Foundation,1
The Laura and John Arnold Foundation,1
National Institute on Aging,1
Major Science and Technology Projects,1
"This work is supported by National Key Laboratory of Software Environment at Beihang University, National 973 Program (Grant No. 2013CB329601) and National Natural Science Foundation of China (Grant No. 61472032) , (Grant No. 61672075) and (Grant No. 61690",1
Key Science Research Development Plan Zhejiang Province,1
Natural Science Foundation of Zhejiang,1
Jiangsu Province Key R&D Project,1
Engineering & Physical Sciences Research Council,1
"University of Cambridge via the Trust & Technology Initiative, and Microsoft via the Microsoft Cloud Computing Research Centre",1
Universidade de Macau,1
Open Fund for Discipline Construction,1
"Institute of Physical Science and Information Technology, Anhui University",1
MIUR,1
Office of Science,1
National Renewable Energy Laboratory,1
"Race and Difference Initiative, Emory University",1
Office of Energy Efficiency and Renewable Energy,1
CICAEET,1
State Key Laboratory of Information Security,1
2015 Project of six personnel in Jiangsu Province,1
Tekes,1
Institute of Food and Agricultural Sciences,1
Institute of Information & Communications Technology Planning & Evaluation,1
Korea Institute for Advancement of Technology,1
RCUK ,1
Economic and Social Research Council (ESRC),1
EOSC-Life,1
EMBL-EBI,1
National Defense Basic Scientific Research Program of China,1
Institute of Museum and Library Services,1
Young Scientists Fund,1
Major Research Plan,1
Key Programme,1
Featured Areas Research Center Program,1
Center for Cyber&#x2013;Physical System Innovation,1
Ministry of Education (MOE) in Taiwan,1
RCUK's Horizon Digital Economy Research Institute,1
Horizon Centre for Doctoral Training at the University of Nottingham,1
International Science 8 Technology Cooperation Program of China,1
111 project,1
China Hunan Provincial Science 8 Technology Program,1
None,1
"Ministry of Higher Education, Malaysia",1
China Specialized Research Fund for the Doctoral Program of Higher Education,1
Key Laboratory of Computer Network and Information Integration of the Ministry of Education of China,1
NSFC–Guangdong Joint Fund,1
"Collaborative Innovation Center of Wireless Communications Technology, Hong Kong Research Grant Council",1
Jiangsu Provincial Natural Science Foundation of China,1
Jiangsu Provincial Key Laboratory of Network and Information Security,1
Provincial Natural Science Foundation of Jiangsu Province,1
"Research Councils UK Digital Economy Programme, Web Science Doctoral Training Centre, University of Southampton",1
Zhejiang Provincial Natural Science Foundation of China,1
National 973 Program,1
"Deanship of Scientific Research, King Saud University for funding through Vice Deanship of Scientific Research Chairs",1
A.G. Leventis Foundation,1
South African National Research Foundation,1
University of Washington Office of International Affairs,1
Universiti Kebangsaan Malaysia,1
National Nature Science Foundation of China under Grant,1
"Open Project of the State Key Laboratory of Information Security, Institute of Information 402 Engineering, Chinese Academy of Sciences",1
Innovation Fund Denmark,1
Industriens Uddannelses- og Samarbejdsfond,1
China NSF,1
Open Project Program of the State Key Laboratory of Mathematical Engineering and Advanced Computing,1
Science and Technology Innovation 2030 - New Generation Artificial Intelligence,1
Joint Scientific Research Foundation of the State Education Ministry,1
Alibaba Innovation Research AIR Program,1
Utah Genome Project,1
university of utah,1
FAU Erlangen-Nuremberg,1
LMU Munich,1
Thurgau Institute of Economics,1
Science and Technology Support Program of Hubei Province,1
Youth Talent Project of Science and Technology Research Program of Hubei Provincial Education Department,1
Innovation Fund of Huazhong University of Science and Technology,1
University of Pittsburgh,1
Hallym University,1
Key Lab of Information Network Security of Ministry of Public Security,1
Chengdu Science and Technology Bureau,1
“la Caixa” Foundation,1
BUPT Excellent Ph.D. Students Foundation,1
Hainan Provincial Department of Science and Technology,1
